{
  "bilanz": {
    "aktiva": [
      {
        "ebene": 0,
        "konzept": "de-gaap-ci_bs.ass",
        "label": "Bilanzsumme, Summe Aktiva",
        "wert_gj": 1700000.0,
        "wert_vj": 1476500.0,
        "quelle": [
          "0210",
          "0440",
          "0441",
          "0450",
          "0520",
          "0521",
          "0650",
          "1000",
          "1140",
          "1200",
          "1400"
        ]
      },
      {
        "ebene": 1,
        "konzept": "de-gaap-ci_bs.ass.fixAss",
        "label": "Anlagevermögen",
        "wert_gj": 943000.0,
        "wert_vj": 876500.0,
        "quelle": [
          "0210",
          "0440",
          "0441",
          "0450",
          "0520",
          "0521",
          "0650"
        ]
      },
      {
        "ebene": 2,
        "konzept": "de-gaap-ci_bs.ass.fixAss.tan",
        "label": "Sachanlagen",
        "wert_gj": 943000.0,
        "wert_vj": 876500.0,
        "quelle": [
          "0210",
          "0440",
          "0441",
          "0450",
          "0520",
          "0521",
          "0650"
        ]
      },
      {
        "ebene": 3,
        "konzept": "de-gaap-ci_bs.ass.fixAss.tan.landBuildings",
        "label": "Grundstücke, grundstücksgleiche Rechte und Bauten einschließlich der Bauten auf fremden Grundstücken",
        "wert_gj": 520000.0,
        "wert_vj": 545000.0,
        "quelle": [
          "0210"
        ]
      },
      {
        "ebene": 3,
        "konzept": "de-gaap-ci_bs.ass.fixAss.tan.machinery",
        "label": "technische Anlagen und Maschinen",
        "wert_gj": 295000.0,
        "wert_vj": 170000.0,
        "quelle": [
          "0440",
          "0441",
          "0450"
        ]
      },
      {
        "ebene": 3,
        "konzept": "de-gaap-ci_bs.ass.fixAss.tan.otherEquipm",
        "label": "andere Anlagen, Betriebs- und Geschäftsausstattung",
        "wert_gj": 128000.0,
        "wert_vj": 161500.0,
        "quelle": [
          "0520",
          "0521",
          "0650"
        ]
      },
      {
        "ebene": 1,
        "konzept": "de-gaap-ci_bs.ass.currAss",
        "label": "Umlaufvermögen",
        "wert_gj": 757000.0,
        "wert_vj": 600000.0,
        "quelle": [
          "1000",
          "1140",
          "1200",
          "1400"
        ]
      },
      {
        "ebene": 2,
        "konzept": "de-gaap-ci_bs.ass.currAss.inventory",
        "label": "Vorräte",
        "wert_gj": 90000.0,
        "wert_vj": 75000.0,
        "quelle": [
          "1140"
        ]
      },
      {
        "ebene": 3,
        "konzept": "de-gaap-ci_bs.ass.currAss.inventory.material",
        "label": "Roh-, Hilfs- und Betriebsstoffe",
        "wert_gj": 90000.0,
        "wert_vj": 75000.0,
        "quelle": [
          "1140"
        ]
      },
      {
        "ebene": 2,
        "konzept": "de-gaap-ci_bs.ass.currAss.receiv",
        "label": "Forderungen und sonstige Vermögensgegenstände",
        "wert_gj": 75000.0,
        "wert_vj": 65000.0,
        "quelle": [
          "1400"
        ]
      },
      {
        "ebene": 3,
        "konzept": "de-gaap-ci_bs.ass.currAss.receiv.trade",
        "label": "Forderungen aus Lieferungen und Leistungen",
        "wert_gj": 75000.0,
        "wert_vj": 65000.0,
        "quelle": [
          "1400"
        ]
      },
      {
        "ebene": 2,
        "konzept": "de-gaap-ci_bs.ass.currAss.cashEquiv",
        "label": "Kassenbestand, Bundesbankguthaben, Guthaben bei Kreditinstituten und Schecks",
        "wert_gj": 592000.0,
        "wert_vj": 460000.0,
        "quelle": [
          "1000",
          "1200"
        ]
      },
      {
        "ebene": 3,
        "konzept": "de-gaap-ci_bs.ass.currAss.cashEquiv.cash",
        "label": "Kassenbestand, Bundesbankguthaben, Guthaben bei Kreditinstituten und Schecks; Kasse",
        "wert_gj": 52000.0,
        "wert_vj": 40000.0,
        "quelle": [
          "1000"
        ]
      },
      {
        "ebene": 3,
        "konzept": "de-gaap-ci_bs.ass.currAss.cashEquiv.bank",
        "label": "Kassenbestand, Bundesbankguthaben, Guthaben bei Kreditinstituten und Schecks; Guthaben bei Kreditinstituten",
        "wert_gj": 540000.0,
        "wert_vj": 420000.0,
        "quelle": [
          "1200"
        ]
      }
    ],
    "passiva": [
      {
        "ebene": 0,
        "konzept": "de-gaap-ci_bs.eqLiab",
        "label": "Bilanzsumme, Summe Passiva",
        "wert_gj": 1700000.0,
        "wert_vj": 1476500.0,
        "quelle": [
          "(abgeleitet aus GuV)",
          "0670",
          "0671",
          "0800",
          "0860",
          "0950",
          "1600",
          "1740"
        ]
      },
      {
        "ebene": 1,
        "konzept": "de-gaap-ci_bs.eqLiab.equity",
        "label": "Eigenkapital",
        "wert_gj": 530000.0,
        "wert_vj": 330000.0,
        "quelle": [
          "(abgeleitet aus GuV)",
          "0800",
          "0860"
        ]
      },
      {
        "ebene": 2,
        "konzept": "de-gaap-ci_bs.eqLiab.equity.subscribed",
        "label": "Gezeichnetes Kapital / Kapitalkonto / Kapitalanteile",
        "wert_gj": 50000.0,
        "wert_vj": 50000.0,
        "quelle": [
          "0800"
        ]
      },
      {
        "ebene": 2,
        "konzept": "de-gaap-ci_bs.eqLiab.equity.retainedEarnings",
        "label": "Eigenkapital, Gewinn-/Verlustvortrag - bei Kapitalgesellschaften",
        "wert_gj": 280000.0,
        "wert_vj": 130000.0,
        "quelle": [
          "0860"
        ]
      },
      {
        "ebene": 2,
        "konzept": "de-gaap-ci_bs.eqLiab.equity.netIncome",
        "label": "Eigenkapital, Jahresüberschuss/-fehlbetrag (Bilanz) - bei Kapitalgesellschaften",
        "wert_gj": 200000.0,
        "wert_vj": 150000.0,
        "quelle": [
          "(abgeleitet aus GuV)"
        ]
      },
      {
        "ebene": 1,
        "konzept": "de-gaap-ci_bs.eqLiab.accruals",
        "label": "Rückstellungen",
        "wert_gj": 86000.0,
        "wert_vj": 65000.0,
        "quelle": [
          "0950"
        ]
      },
      {
        "ebene": 2,
        "konzept": "de-gaap-ci_bs.eqLiab.accruals.tax",
        "label": "Steuerrückstellungen",
        "wert_gj": 86000.0,
        "wert_vj": 65000.0,
        "quelle": [
          "0950"
        ]
      },
      {
        "ebene": 1,
        "konzept": "de-gaap-ci_bs.eqLiab.liab",
        "label": "Verbindlichkeiten",
        "wert_gj": 1084000.0,
        "wert_vj": 1081500.0,
        "quelle": [
          "0670",
          "0671",
          "1600",
          "1740"
        ]
      },
      {
        "ebene": 2,
        "konzept": "de-gaap-ci_bs.eqLiab.liab.bank",
        "label": "Verbindlichkeiten gegenüber Kreditinstituten",
        "wert_gj": 900000.0,
        "wert_vj": 900000.0,
        "quelle": [
          "0670",
          "0671"
        ]
      },
      {
        "ebene": 2,
        "konzept": "de-gaap-ci_bs.eqLiab.liab.trade",
        "label": "Verbindlichkeiten aus Lieferungen und Leistungen",
        "wert_gj": 120000.0,
        "wert_vj": 100000.0,
        "quelle": [
          "1600"
        ]
      },
      {
        "ebene": 2,
        "konzept": "de-gaap-ci_bs.eqLiab.liab.other",
        "label": "sonstige Verbindlichkeiten",
        "wert_gj": 64000.0,
        "wert_vj": 81500.0,
        "quelle": [
          "1740"
        ]
      }
    ],
    "summe_aktiva_gj": 1700000.0,
    "summe_aktiva_vj": 1476500.0,
    "summe_passiva_gj": 1700000.0,
    "summe_passiva_vj": 1476500.0
  },
  "guv": {
    "positionen": [
      {
        "ebene": 0,
        "konzept": "de-gaap-ci_is",
        "label": "Gewinn- und Verlustrechnung",
        "wert_gj": 200000.0,
        "wert_vj": 150000.0,
        "quelle": [
          "2100",
          "3300",
          "3310",
          "4100",
          "4130",
          "4210",
          "4240",
          "4360",
          "4830",
          "4900",
          "7610",
          "8400",
          "8401"
        ]
      },
      {
        "ebene": 1,
        "konzept": "de-gaap-ci_is.netIncome",
        "label": "Jahresüberschuss/-fehlbetrag",
        "wert_gj": 200000.0,
        "wert_vj": 150000.0,
        "quelle": [
          "2100",
          "3300",
          "3310",
          "4100",
          "4130",
          "4210",
          "4240",
          "4360",
          "4830",
          "4900",
          "7610",
          "8400",
          "8401"
        ]
      },
      {
        "ebene": 2,
        "konzept": "de-gaap-ci_is.netIncome.eat",
        "label": "Ergebnis nach Steuern",
        "wert_gj": 200000.0,
        "wert_vj": 150000.0,
        "quelle": [
          "2100",
          "3300",
          "3310",
          "4100",
          "4130",
          "4210",
          "4240",
          "4360",
          "4830",
          "4900",
          "7610",
          "8400",
          "8401"
        ]
      },
      {
        "ebene": 3,
        "konzept": "de-gaap-ci_is.netIncome.regular.operatingTC",
        "label": "Betriebsergebnis (GKV)",
        "wert_gj": 320000.0,
        "wert_vj": 251000.0,
        "quelle": [
          "3300",
          "3310",
          "4100",
          "4130",
          "4210",
          "4240",
          "4360",
          "4830",
          "4900",
          "8400",
          "8401"
        ]
      },
      {
        "ebene": 4,
        "konzept": "de-gaap-ci_is.netIncome.regular.operatingTC.grossTradingProfit",
        "label": "Rohergebnis (GKV)",
        "wert_gj": 2560000.0,
        "wert_vj": 2300000.0,
        "quelle": [
          "3300",
          "3310",
          "8400",
          "8401"
        ]
      },
      {
        "ebene": 5,
        "konzept": "de-gaap-ci_is.netIncome.regular.operatingTC.grossTradingProfit.totalOutput",
        "label": "Gesamtleistung (GKV)",
        "wert_gj": 3800000.0,
        "wert_vj": 3420000.0,
        "quelle": [
          "8400",
          "8401"
        ]
      },
      {
        "ebene": 6,